{
  "id": "charmander",
  "label": "Salamèche",
  "dexNumber": 4,
  "types": [
    "fire"
  ],
  "stats": {
    "hp": 35,
    "attack": 40,
    "defense": 35,
    "specialAttack": 40,
    "specialDefense": 35,
    "speed": 45
  },
  "abilityIds": [
    "blaze"
  ],
  "learnset": [
    {
      "level": 1,
      "moveId": "ember"
    },
    {
      "level": 3,
      "moveId": "growl"
    }
  ]
}
